Source,Package name,Package ID,ISBN,Book Title,Year,ISSN,Series Title,Volume,Imprint,Editor(s)/Author(s),Available Online,Shortcut URL
HS,eBook - Health Professions 2011,EBCHP11,9780723436539,State-of-the-Art Orthodontics,2011,,,,Mosby,Hugo Trevisi,22-Jun-2011,http://www.sciencedirect.com/science/book/9780723436539
HS,eBook - Veterinary Medicine 2011,EBCVM11,9780723436027,Color Atlas of Diseases and Disorders of Cattle (Third Edition),2011,,,,Mosby,,22-Jun-2011,http://www.sciencedirect.com/science/book/9780723436027
HS,eBook - Veterinary Medicine 2011,EBCVM11,9781437706543,"Fluid, Electrolyte, and Acid-Base Disorders in Small Animal Practice (Fourth Edition)",2012,,,,W.B. Saunders,,22-Jun-2011,http://www.sciencedirect.com/science/book/9781437706543
HS,eBook - Veterinary Medicine 2011,EBCVM11,9781437719864,Fowler's Zoo and Wild Animal Medicine,2012,,,,W.B. Saunders,,22-Jun-2011,http://www.sciencedirect.com/science/book/9781437719864
S&T,eBook - Agricultural and Biological Sciences 2011,EBCABS11,9780123813510,Insect Ecology (Third Edition),2011,,,,Academic Press,Timothy D. Schowalter,22-Apr-2011,http://www.sciencedirect.com/science/book/9780123813510
S&T,"eBook - Biochemistry, Genetics and Molecular Biology 2011",EBCBGMB11,9780123849359,Peptide and Protein Delivery,2011,,,,Academic Press,Chris Van Der Walle,22-Apr-2011,http://www.sciencedirect.com/science/book/9780123849359
S&T,eBook - Engineering 2011,EBCE11,9780080966786,Semi-Active Suspension Control Design for Vehicles,2011,,,,Butterworth-Heinemann,"Sergio M. Savaresi, Charles Poussot-Vassal, Cristiano Spelta, Olivier Sename and Luc Dugard",22-Apr-2011,http://www.sciencedirect.com/science/book/9780080966786
S&T,eBook - Finance 2011,EBCF11,9780123749482,Mergers and Acquisitions Basics: All You Need To Know,2011,,,,Academic Press,Donald DePamphilis,22-Apr-2011,http://www.sciencedirect.com/science/book/9780123749482
S&T,eBook - Finance 2011,EBCF11,9780123749499,Mergers and Acquisitions Basics: Negotiation and Deal Structuring,2011,,,,Academic Press,Donald DePamphilis,22-Apr-2011,http://www.sciencedirect.com/science/book/9780123749499
S&T,eBook - Neuroscience 2011,EBCN11,9780123814098,Essential Neuromodulation,2011,,,,Academic Press,Jeffrey E. Arle and Jay L. Shils,22-Apr-2011,http://www.sciencedirect.com/science/book/9780123814098
S&T,eBook - Chemistry 2011,EBCC11,9780080966854,-- Book Title not available --,2011,0959-6380,Progress in Heterocyclic Chemistry,22C,Elsevier,"Gordon Gribble, John A. Joule",21-Sep-2010,http://www.sciencedirect.com/science/book/9780080966854
S&T,eBook - Chemical Engineering 2011,EBCCE11,9780444535634,Fuel Cells,2011,,,,Elsevier,"Dushyant Shekhawat, J.J. Spivey And David A. Berry",21-Mar-2011,http://www.sciencedirect.com/science/book/9780444535634
S&T,eBook - Earth and Planetary Sciences 2011,EBCEPS11,9780444536075,Developments in Palygorskite-Sepiolite Research,2011,1572-4352,Developments in Clay Science,3C,Elsevier,"Emilio Galan, Arieh Singer",21-Jul-2011,http://www.sciencedirect.com/science/book/9780444536075
S&T,"eBook - Biochemistry, Genetics and Molecular Biology 2011",EBCBGMB11,9788131222973,Protein Bioinformatics,2010,,,,Academic Press,M. Michael Gromiha,20-May-2011,http://www.sciencedirect.com/science/book/9788131222973
S&T,eBook - Energy 2011,EBCEN11,9780123838445,Petroleum Engineer's Guide to Oil Field Chemicals and Fluids,2011,,,,Gulf Professional Publishing,Johannes Fink,20-May-2011,http://www.sciencedirect.com/science/book/9780123838445
S&T,eBook - Environmental Science 2011,EBCES11,9780444516732,Philosophy of Ecology,2011,,Handbook of the Philosophy of Science,11,North-Holland,"Dov M. Gabbay, Bryson Brown, Paul Thagard, Kevin De Laplante, Kent Peacock And John Woods",20-May-2011,http://www.sciencedirect.com/science/book/9780444516732
S&T,eBook - Medicine and Dentistry 2011,EBCMD11,9780123819789,Vitamin D (Third Edition),2011,,,,Academic Press,"David Feldman, J. Wesley Pike and John S. Adams",20-May-2011,http://www.sciencedirect.com/science/book/9780123819789
S&T,"eBook - Pharmacology, Toxicology and Pharmaceutical Science 2011",EBCPTPS11,9780444538642,-- Book Title not available --,2011,1872-0854,Advances in Molecular Toxicology,5C,Elsevier,James C. Fishbein,20-Jun-2011,http://www.sciencedirect.com/science/book/9780444538642
S&T,eBook - Engineering 2011,EBCE11,9780123838421,Gas Turbine Engineering Handbook (Fourth Edition),2011,,,,Butterworth-Heinemann,Meherwan P. Boyce,20-Dec-2011,http://www.sciencedirect.com/science/book/9780123838421
S&T,eBook - Neuroscience 2011,EBCN11,9780123865250,Primer on the Autonomic Nervous System (Third Edition),2012,,,,Academic Press,"David Robertson, Italo Biaggioni, Geoffrey Burnstock, Phillip A. Low and Julian F.R. Paton",20-Dec-2011,http://www.sciencedirect.com/science/book/9780123865250
S&T,eBook - Earth and Planetary Sciences 2011,EBCEPS11,9780444563750,Introduction to Volcanic Seismology (Second Edition),2012,,,,Elsevier,Vyacheslav M. Zobin,20-Dec-2011,http://www.sciencedirect.com/science/book/9780444563750
S&T,eBook - Engineering 2011,EBCE11,9780123819604,Measurement and Instrumentation,2012,,,,Butterworth-Heinemann,Alan S. Morris and Reza Langari,20-Dec-2011,http://www.sciencedirect.com/science/book/9780123819604
S&T,eBook - Neuroscience 2011,EBCN11,9780444529039,Neuro-ophthalmology,2011,0072-9752,Handbook of Clinical Neurology,102C,Elsevier,"Christopher Kennard, R. John Leigh",19-May-2011,http://www.sciencedirect.com/science/book/9780444529039
HS,eBook - Clinical Medicine 2011,EBCCM11,9780702035746,Weedon's Skin Pathology Essentials,2012,,,,Churchill Livingstone,,19-Dec-2011,http://www.sciencedirect.com/science/book/9780702035746
S&T,eBook - Agricultural and Biological Sciences 2011,EBCABS11,9780123849052,Marschner's Mineral Nutrition of Higher Plants (Third Edition),2012,,,,Academic Press,Petra Marschner,19-Aug-2011,http://www.sciencedirect.com/science/book/9780123849052
S&T,eBook - Chemical Engineering 2011,EBCCE11,9780444535580,Biointerface Characterization by Advanced IR Spectroscopy,2011,,,,Elsevier,C.-M. Pradier And Y.J. Chabal,19-Aug-2011,http://www.sciencedirect.com/science/book/9780444535580
S&T,eBook - Computer Science 2011,EBCCS11,9781597496049,Web Application Obfuscation,2010,,,,Syngress,"Mario Heiderich, Eduardo Alberto Vela Nava, Gareth  Heyes And David Lindsay",19-Aug-2011,http://www.sciencedirect.com/science/book/9781597496049
S&T,eBook - Earth and Planetary Sciences 2011,EBCEPS11,9780444528643,Earth's Magnetosphere,2011,,,,Elsevier,W.J. Heikkila,19-Aug-2011,http://www.sciencedirect.com/science/book/9780444528643
S&T,eBook - Environmental Science 2011,EBCES11,9780444535672,Fundamentals of Ecological Modelling,2011,0167-8892,Developments in Environmental Modelling,23C,Elsevier,"Sven Erik Jorgensen, Brian D. Fath",19-Aug-2011,http://www.sciencedirect.com/science/book/9780444535672
S&T,eBook - Physics and Astronomy 2011,EBCPA11,9780444534255,Superconductivity in New Materials,2011,1572-0934,Contemporary Concepts of Condensed Matter Science,4C,Elsevier,"Z. Fisk, H.R. Ott",18-Sep-2010,http://www.sciencedirect.com/science/book/9780444534255
S&T,eBook - Energy 2011,EBCEN11,9780123877093,Hydrogen and Fuel Cells (Second Edition),2012,,Sustainable World,,Academic Press,Bent Sorensen,18-Nov-2011,http://www.sciencedirect.com/science/book/9780123877093
S&T,eBook - Earth and Planetary Sciences 2011,EBCEPS11,9780120887590,Introduction to Geophysical Fluid Dynamics,2011,0074-6142,International Geophysics,101C,Academic Press,"Benoit Cushman-Roisin, Jean-Marie Beckers",18-Nov-2011,http://www.sciencedirect.com/science/book/9780120887590
S&T,eBook - Forensics 2011,EBCFOR11,9780123745132,Advanced Topics in Forensic DNA Typing,2012,,,,Academic Press,John M. Butler,18-Nov-2011,http://www.sciencedirect.com/science/book/9780123745132
S&T,eBook - Energy 2011,EBCEN11,9780123813756,Introduction to Optimum Design (Third Edition),2012,,,,Academic Press,Jasbir Arora,18-Nov-2011,http://www.sciencedirect.com/science/book/9780123813756
S&T,eBook - Agricultural and Biological Sciences 2011,EBCABS11,9780123814708,Novel Thermal and Non-Thermal Technologies for Fluid Foods,2012,,,,Academic Press,"P.J. Cullen, Brijesh K. Tiwari and Vasilis Valdramidis",18-Nov-2011,http://www.sciencedirect.com/science/book/9780123814708
S&T,eBook - Engineering 2011,EBCE11,9780123821768,Concrete Portable Handbook,2011,,,,Butterworth-Heinemann,R. Dodge Woodson,18-Nov-2011,http://www.sciencedirect.com/science/book/9780123821768
S&T,eBook - Engineering 2011,EBCE11,9780123876836,Up and Running with AutoCAD 2012: 2D version,2012,,,,Academic Press,Elliot Gindis,18-Nov-2011,http://www.sciencedirect.com/science/book/9780123876836
S&T,eBook - Computer Science 2011,EBCCS11,9780123877666,Heterogeneous Computing with OpenCL,2011,,,,Morgan Kaufmann,Perhaad Mistry and Dana Schaa,18-Nov-2011,http://www.sciencedirect.com/science/book/9780123877666
S&T,eBook - Engineering 2011,EBCE11,9780123813831,Biofluid Mechanics,2012,,Biomedical Engineering,,Academic Press,"David Rubenstein, Wei Yin and Mary D. Frame",18-Nov-2011,http://www.sciencedirect.com/science/book/9780123813831
S&T,eBook - Computer Science 2011,EBCCS11,9780123884268,CUDA Application Design and Development,2012,,,,Morgan Kaufmann,Rob Farber,18-Nov-2011,http://www.sciencedirect.com/science/book/9780123884268
S&T,eBook - Chemical Engineering 2011,EBCCE11,9781437735208,Micromixers (Second Edition),2012,,,,William Andrew Publishing,Nam-Trung Nguyen,18-Nov-2011,http://www.sciencedirect.com/science/book/9781437735208
S&T,eBook - Energy 2011,EBCEN11,9781856179829,Gas Sweetening and Processing Field Manual,2011,,,,Gulf Professional Publishing,Maurice Stewart and Ken Arnold,18-Nov-2011,http://www.sciencedirect.com/science/book/9781856179829
S&T,eBook - Chemistry 2011,EBCC11,9780123869845,Infrared and Raman Spectroscopy,2011,,,,Elsevier,Peter Larkin,18-May-2011,http://www.sciencedirect.com/science/book/9780123869845
S&T,eBook - Engineering 2011,EBCE11,9780123852021,Logistics Operations and Management,2011,,,,Elsevier,"Reza Farahani, Shabnam Rezapour and Laleh Kardar",18-May-2011,http://www.sciencedirect.com/science/book/9780123852021
S&T,eBook - Forensics 2011,EBCFOR11,9780123822413,Shooting Incident Reconstruction (Second Edition),2011,,,,Academic Press,Michael G. Haag and Lucien C. Haag,18-May-2011,http://www.sciencedirect.com/science/book/9780123822413
S&T,"eBook - Pharmacology, Toxicology and Pharmaceutical Science 2011",EBCPTPS11,9780123815378,Global Clinical Trials,2011,,,,Academic Press,Richard Chin and Menghis Bairu,18-May-2011,http://www.sciencedirect.com/science/book/9780123815378
S&T,eBook - Engineering 2011,EBCE11,9780123854773,The Definitive Guide to the ARM Cortex-M0,2011,,,,Newnes,Joseph Yiu,18-May-2011,http://www.sciencedirect.com/science/book/9780123854773
S&T,eBook - Agricultural and Biological Sciences 2011,EBCABS11,9780123750211,Molecular Wine Microbiology,2011,,,,Academic Press,"Alfonso V. Carrascosa Santiago, Rosario Munoz and Ramon Gonzalez Garcia",18-Mar-2011,http://www.sciencedirect.com/science/book/9780123750211
S&T,eBook - Chemical Engineering 2011,EBCCE11,9780444532244,Industrial Biofouling,2010,,,,Elsevier,T. Reg Bott,18-Mar-2011,http://www.sciencedirect.com/science/book/9780444532244
S&T,eBook - Chemical Engineering 2011,EBCCE11,9781437778427,Risks of Hazardous Wastes,2011,,,,William Andrew Publishing,Paul E. Rosenfeld And Lydia Feng,18-Mar-2011,http://www.sciencedirect.com/science/book/9781437778427
S&T,eBook - Computer Science 2011,EBCCS11,9780123851260,Data Architecture,2011,,,,Morgan Kaufmann,Charles  Tupper,18-Mar-2011,http://www.sciencedirect.com/science/book/9780123851260
S&T,eBook - Engineering 2011,EBCE11,9780123851222,Stability of Structures,2011,,,,Butterworth-Heinemann,Chai H. Yoo and Sung Lee,18-Mar-2011,http://www.sciencedirect.com/science/book/9780123851222
S&T,eBook - Engineering 2011,EBCE11,9780123744838,Wireless Communications Over Rapidly Time-Varying Channels,2011,,,,Academic Press,Franz Hlawatsch and Gerald Matz,18-Mar-2011,http://www.sciencedirect.com/science/book/9780123744838
S&T,eBook - Earth and Planetary Sciences 2011,EBCEPS11,9780123851444,Ultrahigh Pressure Metamorphism,2011,,,,Elsevier,"Larissa Dobrzhinetskaya, Shah Wali Faryad, Simon Wallis and Simon Cuthbert",18-Mar-2011,http://www.sciencedirect.com/science/book/9780123851444
S&T,eBook - Mathematics 2011,EBCM11,9780444515759,Exploring Monte Carlo Methods,2011,,,,Elsevier,William L. Dunn And J. Kenneth Shultis,18-Mar-2011,http://www.sciencedirect.com/science/book/9780444515759
S&T,eBook - Chemical Engineering 2011,EBCCE11,9780444528827,Lead-Acid Batteries: Science and Technology,2011,,,,Elsevier,D. Pavlov,17-Jun-2011,http://www.sciencedirect.com/science/book/9780444528827
S&T,eBook - Computer Science 2011,EBCCS11,9781597496599,iPhone and iOS Forensics,2011,,,,Syngress,Andrew Hoog And Katie Strzempka,17-Jun-2011,http://www.sciencedirect.com/science/book/9781597496599
S&T,eBook - Computer Science 2011,EBCCS11,9781597496537,The Basics of Information Security,2011,,,,Syngress,Jason Andress,17-Jun-2011,http://www.sciencedirect.com/science/book/9781597496537
S&T,eBook - Engineering 2011,EBCE11,9781437778892,Adhesives Technology for Electronic Applications (Second Edition),2011,,Materials and Processes for Electronic Applications,,William Andrew Publishing,James J. Licari And Dale W. Swanson,17-Jun-2011,http://www.sciencedirect.com/science/book/9781437778892
S&T,eBook - Engineering 2011,EBCE11,9780123855466,Petroleum Rock Mechanics,2012,,,,Gulf Professional Publishing,Bernt Aadnoy and Reza Looyeh,17-Jun-2011,http://www.sciencedirect.com/science/book/9780123855466
S&T,eBook - Forensics 2011,EBCFOR11,9781597496513,Android Forensics,2011,,,,Syngress,Andrew Hoog,17-Jun-2011,http://www.sciencedirect.com/science/book/9781597496513
S&T,eBook - Mathematics 2011,EBCM11,9780123877796,"Kinetic Boltzmann, Vlasov and Related Equations",2011,,,,Elsevier,"Alexander Sinitsyn, Eugene Dulov And Victor Vedenyapin",17-Jun-2011,http://www.sciencedirect.com/science/book/9780123877796
S&T,eBook - Mathematics 2011,EBCM11,9780444518620,Philosophy of Statistics,2011,,,7,North-Holland,"Dov M. Gabbay, Prasanta S. Bandyopadhyay, Malcolm R. Forster, Paul Thagard And John Woods",17-Jun-2011,http://www.sciencedirect.com/science/book/9780444518620
S&T,eBook - Materials Science 2011,EBCMS11,9780080963556,Atomic and Molecular Manipulation,2011,1876-2778,Frontiers of Nanoscience,2C,Elsevier,"Andrew J. Mayne, Gerald Dujardin",16-Jul-2011,http://www.sciencedirect.com/science/book/9780080963556
S&T,"eBook - Biochemistry, Genetics and Molecular Biology 2011",EBCBGMB11,9780123809209,"The Laboratory Rabbit, Guinea Pig, Hamster, and Other Rodents",2012,,American College of Laboratory Animal Medicine,,Academic Press,"Mark A. Suckow, Karla A. Stevens and Ronald P. Wilson",16-Dec-2011,http://www.sciencedirect.com/science/book/9780123809209
S&T,eBook - Computer Science 2011,EBCCS11,9780123785916,Global UX,2011,,,,Morgan Kaufmann,Whitney Quesenbery and Daniel Szuc,16-Dec-2011,http://www.sciencedirect.com/science/book/9780123785916
S&T,eBook - Earth and Planetary Sciences 2011,EBCEPS11,9780444530004,Deep-Sea Sediments,2011,0070-4571,Developments in Sedimentology,63C,Elsevier,"Heiko HuNeke, Thierry Mulder",16-Dec-2010,http://www.sciencedirect.com/science/book/9780444530004
S&T,"eBook - Biochemistry, Genetics and Molecular Biology 2011",EBCBGMB11,9780123878199,"Growth Factors and Their Receptors in Cell Differentiation, Cancer and Cancer Therapy",2011,,,,Elsevier,Gajanan V. Sherbet,15-Jul-2011,http://www.sciencedirect.com/science/book/9780123878199
S&T,eBook - Chemical Engineering 2011,EBCCE11,9780444537218,Best Practices for Environmental Project Teams,2011,,,,Elsevier,Stephen Massey,15-Jul-2011,http://www.sciencedirect.com/science/book/9780444537218
S&T,eBook - Engineering 2011,EBCE11,9781437735147,Applied Plastics Engineering Handbook,2011,,Plastics Design Library,,William Andrew Publishing,Myer Kutz,15-Jul-2011,http://www.sciencedirect.com/science/book/9781437735147
S&T,eBook - Engineering 2011,EBCE11,9780123850812,Matlab (Second Edition),2012,,,,Butterworth-Heinemann,Stormy Attaway,15-Jul-2011,http://www.sciencedirect.com/science/book/9780123850812
S&T,eBook - Materials Science 2011,EBCMS11,9780080967899,Extractive Metallurgy of Copper (Fifth Edition),2011,,,,Elsevier,"Mark E. Schlesinger, Matthew J. King, Kathryn C. Sole and William G. Davenport",15-Jul-2011,http://www.sciencedirect.com/science/book/9780080967899
HS,eBook - Clinical Medicine 2011,EBCCM11,9780443069673,Brain Tumors (Third Edition),2011,,,,W.B. Saunders,,15-Dec-2011,http://www.sciencedirect.com/science/book/9780443069673
HS,eBook - Health Professions 2011,EBCHP11,9780323068956,Contemporary Esthetic Dentistry,2012,,,,Mosby,Steven D. Waldman,15-Dec-2011,http://www.sciencedirect.com/science/book/9780323068956
HS,eBook - Veterinary Medicine 2011,EBCVM11,9781437706574,Small Animal Clinical Diagnosis by Laboratory Methods (Fifth Edition),2012,,,,W.B. Saunders,"Vern L. Katz, Gretchen Lentz, Rogerio A. Lobo and David Gershenson",15-Dec-2011,http://www.sciencedirect.com/science/book/9781437706574
S&T,"eBook - Pharmacology, Toxicology and Pharmaceutical Science 2011",EBCPTPS11,9780444535849,Advances in Molecular Toxicology,2010,1872-0854,Advances in Molecular Toxicology,4C,Elsevier,James C. Fishbein,14-May-2010,http://www.sciencedirect.com/science/book/9780444535849
S&T,eBook - Agricultural and Biological Sciences 2011,EBCABS11,9780123820181,Pulse Foods,2011,,,,Academic Press,"Brijesh K. Tiwari, Aoife Gowen and Brian McKenna",14-Mar-2011,http://www.sciencedirect.com/science/book/9780123820181
S&T,eBook - Computer Science 2011,EBCCS11,9780123744944,Architecture of Network Systems,2011,,,,Morgan Kaufmann,Dimitrios Serpanos and Tilman Wolf,14-Mar-2011,http://www.sciencedirect.com/science/book/9780123744944
S&T,eBook - Computer Science 2011,EBCCS11,9780123822314,Brave NUI World,2011,,,,Morgan Kaufmann,Daniel Wigdor and Dennis Wixon,14-Mar-2011,http://www.sciencedirect.com/science/book/9780123822314
S&T,eBook - Computer Science 2011,EBCCS11,9780123820204,Database Modeling and Design (Fifth Edition),2011,,The Morgan Kaufmann Series in Data Management Systems,,Morgan Kaufmann,"Toby J. Teorey, Sam S. Lightstone, Tom Nadeau  and H.V. Jagadish",14-Mar-2011,http://www.sciencedirect.com/science/book/9780123820204
S&T,eBook - Chemical Engineering 2011,EBCCE11,9780123750495,-- Book Title not available --,2011,1573-4285,Interface Science and Technology,18C,Elsevier,"Soo-Jin Park, Min-Kang Seo",14-Jul-2011,http://www.sciencedirect.com/science/book/9780123750495
S&T,eBook - Agricultural and Biological Sciences 2011,EBCABS11,9780123808868,Flour and Breads and their Fortification in Health and Disease Prevention,2011,,,,Academic Press,"Victor Preedy, Ronald Watson and Vinood Patel",14-Jan-2011,http://www.sciencedirect.com/science/book/9780123808868
S&T,"eBook - Biochemistry, Genetics and Molecular Biology 2011",EBCBGMB11,9780123705815,Structural Biology Using Electrons and X-rays,2011,,,,Academic Press,Michael F. Moody,14-Jan-2011,http://www.sciencedirect.com/science/book/9780123705815
S&T,eBook - Computer Science 2011,EBCCS11,9780123748560,Data Mining (Third Edition),2010,,The Morgan Kaufmann Series in Data Management Systems,,Morgan Kaufmann,"Ian H. Witten, Eibe Frank and Mark A. Hall",14-Jan-2011,http://www.sciencedirect.com/science/book/9780123748560
S&T,eBook - Computer Science 2011,EBCCS11,9780123751065,Developing High Quality Data Models,2011,,,,Morgan Kaufmann,Matthew West,14-Jan-2011,http://www.sciencedirect.com/science/book/9780123751065
S&T,eBook - Computer Science 2011,EBCCS11,9781597496254,Securing SQL Server,2011,,,,Syngress,Denny Cherry,14-Jan-2011,http://www.sciencedirect.com/science/book/9781597496254
S&T,eBook - Engineering 2011,EBCE11,9781437744613,Handbook of Adhesives and Surface Preparation,2011,,,,William Andrew Publishing,Sina Ebnesajjad,14-Jan-2011,http://www.sciencedirect.com/science/book/9781437744613
S&T,eBook - Engineering 2011,EBCE11,9780080966748,Hydraulics and Pneumatics (Third Edition),2011,,,,Butterworth-Heinemann,Andrew Parr,14-Jan-2011,http://www.sciencedirect.com/science/book/9780080966748
S&T,eBook - Environmental Science 2011,EBCES11,9780123814265,Field Guide to Freshwater Invertebrates of North America,2011,,,,Academic Press,James H. Thorp and D. Christopher Rogers,14-Jan-2011,http://www.sciencedirect.com/science/book/9780123814265
S&T,eBook - Finance 2011,EBCF11,9780123748386,An Introduction to Trading in the Financial Markets: Market Basics,2011,,,,Academic Press,"R. ""Tee"" Williams",14-Jan-2011,http://www.sciencedirect.com/science/book/9780123748386
S&T,eBook - Finance 2011,EBCF11,9780123748393,An Introduction to Trading in the Financial Markets,2011,,,,Academic Press,"R. ""Tee"" Williams",14-Jan-2011,http://www.sciencedirect.com/science/book/9780123748393
S&T,eBook - Finance 2011,EBCF11,9780123750822,International Investments in Private Equity,2011,,,,Academic Press,Peter Cornelius,14-Jan-2011,http://www.sciencedirect.com/science/book/9780123750822
S&T,eBook - Forensics 2011,EBCFOR11,9781597496131,Cybercrime and Espionage,2011,,,,Syngress,Will Gragido and John Pirc,14-Jan-2011,http://www.sciencedirect.com/science/book/9781597496131
S&T,eBook - Forensics 2011,EBCFOR11,9781597495806,Windows Registry Forensics,2011,,,,Syngress,Harlan Carvey,14-Jan-2011,http://www.sciencedirect.com/science/book/9781597495806
S&T,eBook - Forensics 2011,EBCFOR11,9781597496230,XBOX 360 Forensics,2011,,,,Syngress,Steven Bolt,14-Jan-2011,http://www.sciencedirect.com/science/book/9781597496230
S&T,eBook - Mathematics 2011,EBCM11,9780123849588,Computability Theory,2011,,,,Academic Press,Herbert B. Enderton,14-Jan-2011,http://www.sciencedirect.com/science/book/9780123849588
S&T,eBook - Mathematics 2011,EBCM11,9780123849564,Introductory Statistical Thermodynamics,2011,,,,Academic Press,"Nils Dalarsson, Mariana Dalarsson and Leonardo Golubovic",14-Jan-2011,http://www.sciencedirect.com/science/book/9780123849564
S&T,eBook - Mathematics 2011,EBCM11,9780123846525,Traveling Wave Analysis of Partial Differential Equations,2011,,,,Academic Press,Graham Griffiths and William E. Schiesser,14-Jan-2011,http://www.sciencedirect.com/science/book/9780123846525
S&T,eBook - Engineering 2011,EBCE11,9780123819574,Applied Drilling Circulation Systems,2011,,,,Gulf Professional Publishing,"Boyun Guo, PhD, and Gefei Liu",14-Feb-2011,http://www.sciencedirect.com/science/book/9780123819574
S&T,eBook - Energy 2011,EBCEN11,9780123838803,Geothermal Reservoir Engineering (Second Edition),2011,,,,Academic Press,Malcolm Alister Grant and Paul F. Bixley,14-Feb-2011,http://www.sciencedirect.com/science/book/9780123838803
S&T,eBook - Materials Science 2011,EBCMS11,9780080966724,Introduction to Dislocations (Fifth Edition),2011,,,,Butterworth-Heinemann,D. Hull and D.J. Bacon,14-Feb-2011,http://www.sciencedirect.com/science/book/9780080966724
S&T,eBook - Physics and Astronomy 2011,EBCPA11,9780123838742,Classical and Quantum Information,2011,,,,Academic Press,Dan C. Marinescu,14-Feb-2011,http://www.sciencedirect.com/science/book/9780123838742
S&T,"eBook - Pharmacology, Toxicology and Pharmaceutical Science 2011",EBCPTPS11,9780123820327,Reproductive and Developmental Toxicology,2011,,,,Academic Press,Ramesh C. Gupta,14-Feb-2011,http://www.sciencedirect.com/science/book/9780123820327
S&T,eBook - Computer Science 2011,EBCCS11,9781597496650,Low Tech Hacking,2012,,,,Syngress,"Jack Wiles, Terry Gudaitis, Jennifer Jabbusch, Russ Rogers and Sean Lowther",13-Dec-2011,http://www.sciencedirect.com/science/book/9781597496650
S&T,eBook - Engineering 2011,EBCE11,9780123852144,Lifelong Learning for Engineers and Scientists in the Information Age,2012,,,,Elsevier,"Ashok Naimpally, Hema Ramachandran and Caroline Smith",13-Dec-2011,http://www.sciencedirect.com/science/book/9780123852144
S&T,eBook - Engineering 2011,EBCE11,9781437734614,Fluoropolymer Additives,2013,,,,William Andrew Publishing,Sina Ebnesajjad and Richard Morgan,13-Dec-2011,http://www.sciencedirect.com/science/book/9781437734614
S&T,eBook - Energy 2011,EBCEN11,9780123884466,Nuclear Safety in Light Water Reactors,2012,,,,Academic Press,Bal Raj Sehgal,13-Dec-2011,http://www.sciencedirect.com/science/book/9780123884466
S&T,eBook - Materials Science 2011,EBCMS11,9780123851420,Functional Materials,2012,,,,Elsevier,S. Banerjee and A. Tyagi,13-Dec-2011,http://www.sciencedirect.com/science/book/9780123851420
S&T,eBook - Engineering 2011,EBCE11,9780124158016,"Universe, Human Immortality and Future Human Evaluation",2012,,,,Elsevier,Alexander Bolonkin,13-Dec-2011,http://www.sciencedirect.com/science/book/9780124158016
S&T,eBook - Chemistry 2011,EBCC11,9780124160255,Basic Equations of the Mass Transport through a Membrane Layer,2012,,,,Elsevier,Endre Nagy,13-Dec-2011,http://www.sciencedirect.com/science/book/9780124160255
S&T,eBook - Psychology 2011,EBCP11,9780124160293,The Scientific Foundation of Neuropsychological Assessment,2012,,,,Elsevier,Elbert W. Russell,13-Dec-2011,http://www.sciencedirect.com/science/book/9780124160293
S&T,eBook - Neuroscience 2011,EBCN11,9780444520142,Hyperkinetic Movement Disorders,2011,0072-9752,Handbook of Clinical Neurology,100C,Elsevier,"William J. Weiner, Eduardo Tolosa",13-Apr-2011,http://www.sciencedirect.com/science/book/9780444520142
S&T,eBook - Neuroscience 2011,EBCN11,9780080450315,Muscular Dystrophies,2011,0072-9752,Handbook of Clinical Neurology,101C,Elsevier,"Robert C. Griggs, Anthony A. Amato",13-Apr-2011,http://www.sciencedirect.com/science/book/9780080450315
S&T,eBook - Chemical Engineering 2011,EBCCE11,9780444538956,21st European Symposium on Computer Aided Process Engineering,2011,1570-7946,Computer Aided Chemical Engineering,29C,Elsevier,"E.N. Pistikopoulos, M.C. Georgiadis, A.C. Kokossis",12-Jun-2011,http://www.sciencedirect.com/science/book/9780444538956
